"System response";"relevanceRank";"usabilityRating";"URI"
"dollar have reached an official 15,000-1, but on the black market, according to one anonymous illicit money trader, deals have reached 140,000-1 in cash, with a shortage of bank notes creating a 200,000-1 premium on bank transfers and large overseas deals reaching as much as 300,000-1.";0;1;"http://en.wikinews.org/wiki/Inflation_in_Zimbabwe_becomes_world's_highest_at_11,000%25_and_rising#ev113"
"The National Bank, however, is hesitant to intervene in the marketplace once again due to the positive effects of the leu's appreciation on importers, who can now get products for lower prices, and for consumers, who now have higher purchasing power for imported goods.";0;1;"http://en.wikinews.org/wiki/Romanian_leu_continues_to_surge#ev19"
"Icelandic equity markets have been closed until October 13 due to ""unusual market conditions"" and the Icelandic krona now appears to have itself failed after the collapse of an attempt to fix the exchange rate at 131 Krona to the euro.";1;1;"http://en.wikinews.org/wiki/Iceland_nationalises_Kaupthing_Bank#ev33"
"It is estimated that 170,000 people in the United Kingdom do not receive the minimum payments for their work.";0;1;"http://en.wikinews.org/wiki/Minimum_wage_in_United_Kingdom_increases_to_%c2%a35.35#ev12"
"From January 15, the euro would become the only official means of payment.";0;1;"http://en.wikinews.org/wiki/Lithuania_plans_to_adopt_euro_in_2007#ev24"
