System response;relevanceRank;usabilityRating;URI
Xinhua reported Linux based operating systems are in development for the Chinese market, and the announcement presents business opportunities for those working in the information technology sector.;;1;http://en.wikinews.org/wiki/Chinese_government_prohibits_use_of_Windows_8,_cites_security_concerns#ev76
With their experience in the IT industry, they agreed to comment on this question.;;1;http://en.wikinews.org/wiki/Wikinews_Interview:_Experts_in_IT_industry_comment_about_security_of_WiMAX#ev40
Existing technology will be marketed in the Google name, something which may make all the difference.;;1;http://en.wikinews.org/wiki/Google_plans_free_Internet_phone_service#ev11
3m of that invested in the IT sector.;;1;http://en.wikinews.org/wiki/Venture_capital_investment_in_Ireland_soars_by_35%25#ev7
Out of a record number of applications and 273 nominees, the World Economic Forum (WEF) has chosen the Wikimedia Foundation as one of the 2008 Pioneers of Technology.;;1;http://en.wikinews.org/wiki/Wikimedia_Foundation_among_World_Economic_Forum's_2008_Technology_Pioneers#ev92
