System response;relevanceRank;usabilityRating;URI
The Executive Council also approved the proposal, and the Chief Executive of Hong Kong, Donald Tsang said there is a 'ray of hope' for the democratic development of Hong Kong as a result.;;1;http://en.wikinews.org/wiki/Hong_Kong_Democratic_Party_stirs_up_universal_suffrage_reform_package_controversy#ev95_1
Former South Korean President Roh Moo-Hyun died after falling from the side of a mountain near his house in an apparent suicide, the state-run Yonhap News Agency reported early Saturday.;;1;http://en.wikinews.org/wiki/North_Korea_conducts_test_of_nuclear_weapon#ev40
The police found students watching the New Zealand Fire Service battling the fires they had lit.;;1;http://en.wikinews.org/wiki/New_Zealand_riot_police_use_batons_to_disperse_unruly_pub-crawl#ev24
However scientists with the Department of Conservation, are aiming to overcome this by shifting juveniles.;;1;http://en.wikinews.org/wiki/Short-tailed_bats_to_be_transferred_to_Kapiti_Island,_New_Zealand#ev23
The Zimbabwe Minister of Media, Information and Publicity, Webster Shamu, warned media organisations may have their licences revoked for misusing their licenses to 'vilify' Zimbabwe and its leadership.;;1;http://en.wikinews.org/wiki/Zimbabwe_minister_warns_media#ev37
The Rangers did manage, however, to pick up a precious point, as they managed to send the game into overtime.;;1;http://en.wikinews.org/wiki/NHL:_Rangers_fall_to_Penguins_in_overtime#ev26
A further meeting was held today in which the management decided to stick by their initial decision, however at around 18.;;1;http://en.wikinews.org/wiki/BBC_Radio_1_reverses_%22faggot%22_ruling_hours_after_initial_ban#ev30
"The current New Zealand flag is partially based on the United Kingdom's flag; the new one would be unique to New Zealand.";;1;http://en.wikinews.org/wiki/New_Zealand_begins_process_to_consider_changing_national_flag_design#ev54
"The Mayor has defended the actions of the protesters saying ""All the residents are doing is showing their democratic right - what they feel - and I think that in this country, they have a right to do that,"" he said.";;1;http://en.wikinews.org/wiki/Paedophile_forced_to_flee_Australian_town#ev52
