System response;relevanceRank;usabilityRating;URI
Only passengers with confirmed reservations have been allowed to board flights at Heathrow.;;1;http://en.wikinews.org/wiki/Talks_with_TGWU_and_Gate_Gourmet_to_resume_later_today#ev38
The bus attack took place on a shopping street near the main road that connects the airport with the city, but it is not clear whether it was a suicide bomber ramming the vehicle, or whether the motorbike was parked along side the bus before detonation.;;1;http://en.wikinews.org/wiki/Double_bombing_in_Pakistani_city_leaves_at_least_22_dead#ev22
It went missing around 40 minutes into a flight to Changi International Airport.;;1;http://en.wikinews.org/wiki/AirAsia_disaster:_Bodies,_wreckage_found#ev64
Heavy snow has caused disruption in the United Kingdom with airports and schools closed and delays on the road network.;;1;http://en.wikinews.org/wiki/Snow_causes_disruption_in_UK#ev43
Virgin boss Sir Richard Branson had previously said the move would give BA excessive dominance on Scottish flights.;;1;http://en.wikinews.org/wiki/European_Commission_clears_British_Airways_owner_IAG_to_buy_bmi_from_Lufthansa#ev43
Additional attacks on Beirut's international airport set a fuel tank ablaze.;;1;http://en.wikinews.org/wiki/Hezbollah_and_Israel_exchange_fire_for_fifth_day#ev12
Taiwan) praised this set up as a boost of WiMAX infrastructure in Taiwan.;;1;http://en.wikinews.org/wiki/WiMAX_Forum_will_endorse_M-Taiwan_WiMAX_Application_Lab_in_Hsinchu_and_shows_the_highlights_from_WiMAX_Forum_PlugFest_in_Taipei#ev81
Arroyo claims to suffer from a rare bone disease, and arrived by ambulance at the Manila airport, with neck brace and wheelchair, to go abroad for treatment.;;1;http://en.wikinews.org/wiki/Philippine_court_issues_arrest_warrant_for_former_President_Arroyo#ev21
The airport was evacuated, a government official said, after airport security officials noticed, at around 9:00pm local time on Thursday, that his bag contained a metal canister that looked like a pipe bomb.;;1;http://en.wikinews.org/wiki/Scientist_detained_after_bomb_scare_closes_Miami_airport#ev19
